{
  "event_id": "6b6d2f3e-1a2b-4c5d-8e9f-0a1b2c3d4e5f",
  "occurred_at": "2025-09-06T12:00:00Z",
  "version": 1,
  "producer": "observer-api",
  "schema": "project.deleted@v1",
  "partition_key": 123,
  "payload": {
    "project": {
      "id": 123,
      "name": "Acme Inc",
      "domain": "acme.io",
      "deleted_at": "2025-09-06T12:00:00Z"
    }
  }
}